{
  "schemaVersion": 1,
  "sourceCommit": "aaaaaaaaaaaaaaaaaaaaaaaaaaaaaaaaaaaaaaaa",
  "programId": "4vJ9JU1bJJE96FWSJKvHsmmFADCg4gpZQff4P3bkLKi",
  "sbfSha256": "1111111111111111111111111111111111111111111111111111111111111111",
  "idlSha256": "2222222222222222222222222222222222222222222222222222222222222222",
  "sourceSha256": "3333333333333333333333333333333333333333333333333333333333333333",
  "lockSha256": "4444444444444444444444444444444444444444444444444444444444444444"
}
